{
  "schema_version": "1.0.0",
  "models": {
    "qwen38-27b": { "id": "mlx-community/Qwen3.8-27B-4bit", "dense": true },
    "mimo-9b": { "id": "mlx-community/MiMo-V2.6-Distill-Qwen-9B-OptiQ-4bit" },
    "qwen35-9b": { "id": "mlx-community/Qwen3.5-9B-OptiQ-4bit" },
    "unlimited-ocr": { "id": "mlx-community/Unlimited-OCR-bf16" },
    "stage0_embedding": { "id": "nativ-community/embeddinggemma-2-mxfp8" },
    "stage0_systemone_opendecider": { "id": "manjunathshiva/opendecider-nano" },
    "stage0_systemone_laya": { "id": "convaiinnovations/laya-typed-decisions" }
  },
  "roles": {
    "best": { "model": "qwen38-27b", "egress": "zdr" },
    "default": { "model": "qwen38-27b", "egress": "zdr" },
    "coding": { "model": "qwen38-27b", "egress": "zdr" },
    "long": { "model": "qwen38-27b", "egress": "zdr" },
    "fast": { "model": "mimo-9b", "egress": "zdr" },
    "cheap": { "model": "mimo-9b", "egress": "zdr" },
    "small": { "model": "mimo-9b", "egress": "estate" },
    "judge": { "model": "mimo-9b", "egress": "zdr" },
    "recorder": { "model": "mimo-9b", "egress": "estate" },
    "ocr": { "model": "unlimited-ocr", "egress": "none" },
    "embed": { "model": null, "egress": "none" },
    "stage0_embedding": { "model": "stage0_embedding", "egress": "none" },
    "stage0_systemone_opendecider": { "model": "stage0_systemone_opendecider", "egress": "none" },
    "stage0_systemone_laya": { "model": "stage0_systemone_laya", "egress": "none" }
  },
  "hosts": {
    "workstation": {
      "resident": ["qwen38-27b", "qwen35-9b"],
      "swap": [],
      "roles": {
        "fast": { "model": "qwen35-9b", "egress": "zdr" },
        "cheap": { "model": "qwen35-9b", "egress": "zdr" },
        "small": { "model": "qwen35-9b", "egress": "estate" },
        "judge": { "model": "qwen35-9b", "egress": "zdr" },
        "recorder": { "model": "qwen35-9b", "egress": "estate" }
      }
    },
    "server": {
      "resident": ["qwen38-27b", "mimo-9b"],
      "swap": ["unlimited-ocr"],
      "roles": {}
    }
  }
}
